<?xml version="1.0" encoding="UTF-8"?>
<?xml-stylesheet type="text/xsl" href="BookChapterVerseLine.xsl"?>
<codex 
	xmlns:xsi="http://www.w3.org/2001/XMLSchema-instance"
	xsi:noNamespaceSchemaLocation="BookChapterVerseLine.xsd">
<title>Arian Commentary</title>
<book>
<title>Commentary On Luke</title>
<recension>Latin</recension>
<rendering>English</rendering>
<translator>Jubilees Palimpsest Project</translator>
<publicationyear>2017</publicationyear> 
<authority>Can be updated based on new evidence</authority>
<license>CC BY-SA</license>
<chapter number="1" id="ch1">
	<paragraph>
		<verse number="1">This page is under construction. It will translate the Commentary on Luke in TEI XML. </verse>
		<verse number="2">Volunteer work on this task would be appreciated.</verse>
	</paragraph>
</chapter>
</book>
</codex>